,penyakit,gejala,penyembuhan,dokter,tingkat risiko,combined_content,cleaned_content
52,stroke,"kelemahan mendadak, kesulitan berbicara, kebingungan, kehilangan keseimbangan","terapi rehabilitasi, obat pengencer darah, pembedahan",neurolog,tinggi (50%),"stroke kelemahan mendadak, kesulitan berbicara, kebingungan, kehilangan keseimbangan terapi rehabilitasi, obat pengencer darah, pembedahan neurolog tinggi (50%)",stroke kelemahan mendadak  kesulitan berbicara  kebingungan  kehilangan keseimbangan terapi rehabilitasi  obat pengencer darah  pembedahan neurolog tinggi      
53,kanker prostat,"nyeri panggul, kesulitan berkemih, darah dalam urine, disfungsi ereksi","pembedahan, terapi radiasi, terapi hormon",onkolog,tinggi (30%),"kanker prostat nyeri panggul, kesulitan berkemih, darah dalam urine, disfungsi ereksi pembedahan, terapi radiasi, terapi hormon onkolog tinggi (30%)",kanker prostat nyeri panggul  kesulitan berkemih  darah dalam urine  disfungsi ereksi pembedahan  terapi radiasi  terapi hormon onkolog tinggi      
54,kanker hati,"nyeri perut bagian atas, kehilangan berat badan, mual, jaundice","transplantasi hati, kemoterapi, terapi target",onkolog,tinggi (60%),"kanker hati nyeri perut bagian atas, kehilangan berat badan, mual, jaundice transplantasi hati, kemoterapi, terapi target onkolog tinggi (60%)",kanker hati nyeri perut bagian atas  kehilangan berat badan  mual  jaundice transplantasi hati  kemoterapi  terapi target onkolog tinggi      
55,penyakit jantung koroner,"nyeri dada, sesak napas, kelelahan, palpitasi","perubahan gaya hidup, obat, pembedahan",kardiolog,tinggi (40%),"penyakit jantung koroner nyeri dada, sesak napas, kelelahan, palpitasi perubahan gaya hidup, obat, pembedahan kardiolog tinggi (40%)",penyakit jantung koroner nyeri dada  sesak napas  kelelahan  palpitasi perubahan gaya hidup  obat  pembedahan kardiolog tinggi      
56,Penyakit Alzheimer,"kebingungan, kehilangan memori, perubahan suasana hati, kesulitan berbicara","pengobatan simtomatik, terapi okupasi",neurolog,tinggi (60%),"Penyakit Alzheimer kebingungan, kehilangan memori, perubahan suasana hati, kesulitan berbicara pengobatan simtomatik, terapi okupasi neurolog tinggi (60%)",penyakit alzheimer kebingungan  kehilangan memori  perubahan suasana hati  kesulitan berbicara pengobatan simtomatik  terapi okupasi neurolog tinggi      
57,Penyakit Parkinson,"tremor, kekakuan otot, kesulitan bergerak, perubahan postur","obat, fisioterapi, pembedahan",neurolog,tinggi (30%),"Penyakit Parkinson tremor, kekakuan otot, kesulitan bergerak, perubahan postur obat, fisioterapi, pembedahan neurolog tinggi (30%)",penyakit parkinson tremor  kekakuan otot  kesulitan bergerak  perubahan postur obat  fisioterapi  pembedahan neurolog tinggi      
58,asma alergi,"sesak napas, batuk, mengi saat terpapar alergen","inhaler, penghindaran alergen, terapi imun",pulmonolog,sedang (20%),"asma alergi sesak napas, batuk, mengi saat terpapar alergen inhaler, penghindaran alergen, terapi imun pulmonolog sedang (20%)",asma alergi sesak napas  batuk  mengi saat terpapar alergen inhaler  penghindaran alergen  terapi imun pulmonolog sedang      
59,HIV/AIDS,"demam, keringat malam, penurunan berat badan, kelelahan","antiretroviral, manajemen kesehatan",spesialis infeksi,tinggi (50%),"HIV/AIDS demam, keringat malam, penurunan berat badan, kelelahan antiretroviral, manajemen kesehatan spesialis infeksi tinggi (50%)",hiv aids demam  keringat malam  penurunan berat badan  kelelahan antiretroviral  manajemen kesehatan spesialis infeksi tinggi      
60,tuberkulosis,"batuk berdarah, demam, berkeringat malam, penurunan berat badan","antibiotik, terapi kombinasi",dokter paru-paru,tinggi (25%),"tuberkulosis batuk berdarah, demam, berkeringat malam, penurunan berat badan antibiotik, terapi kombinasi dokter paru-paru tinggi (25%)",tuberkulosis batuk berdarah  demam  berkeringat malam  penurunan berat badan antibiotik  terapi kombinasi dokter paru paru tinggi      
61,gangguan bipolar,"perubahan suasana hati ekstrem, energi tinggi atau rendah, masalah tidur","obat stabilisator suasana hati, terapi",psikiater,tinggi (30%),"gangguan bipolar perubahan suasana hati ekstrem, energi tinggi atau rendah, masalah tidur obat stabilisator suasana hati, terapi psikiater tinggi (30%)",gangguan bipolar perubahan suasana hati ekstrem  energi tinggi atau rendah  masalah tidur obat stabilisator suasana hati  terapi psikiater tinggi      
62,autoimun,"kelelahan, nyeri sendi, ruam, demam","obat imunosupresif, terapi fisik",rheumatolog,bervariasi,"autoimun kelelahan, nyeri sendi, ruam, demam obat imunosupresif, terapi fisik rheumatolog bervariasi",autoimun kelelahan  nyeri sendi  ruam  demam obat imunosupresif  terapi fisik rheumatolog bervariasi
63,celiaca,"kembung, diare, nyeri perut setelah konsumsi gluten",diet bebas gluten,gastroenterolog,sedang (5%),"celiaca kembung, diare, nyeri perut setelah konsumsi gluten diet bebas gluten gastroenterolog sedang (5%)",celiaca kembung  diare  nyeri perut setelah konsumsi gluten diet bebas gluten gastroenterolog sedang     
64,pneumonia,"batuk, demam, sesak napas, nyeri dada","antibiotik, terapi suportif",dokter umum,tinggi (20%),"pneumonia batuk, demam, sesak napas, nyeri dada antibiotik, terapi suportif dokter umum tinggi (20%)",pneumonia batuk  demam  sesak napas  nyeri dada antibiotik  terapi suportif dokter umum tinggi      
65,hepatitis,"kelelahan, kehilangan nafsu makan, nyeri perut, jaundice","antiviral, manajemen simtomatik",hepatolog,tinggi (30%),"hepatitis kelelahan, kehilangan nafsu makan, nyeri perut, jaundice antiviral, manajemen simtomatik hepatolog tinggi (30%)",hepatitis kelelahan  kehilangan nafsu makan  nyeri perut  jaundice antiviral  manajemen simtomatik hepatolog tinggi      
